word	defn	main_meaning	other meaning
世人	 世人	 thế nhân	 thế nhân/người trần/người đời/người phàm tục
图案	 圖案	 đồ án	 đồ án/hoa văn/hình vẽ
暗示	 暗示	 ám thị	 ám chỉ/ám thị/ra hiệu ngầm/gợi ý/nói bóng gió
原理	 原理	 nguyên lí/nguyên lý	 nguyên lý/nguyên lý cơ bản/chân lý lúc nguyên thủy
乐观	 樂觀	 lạc quan	 lạc quan/vui vẻ
国民	 國民	 quốc dân	 quốc dân
景象	 景象	 cảnh tượng	 cảnh tượng/hiện tượng/cảnh
手法	 手法	 thủ pháp	 thủ pháp/bút pháp/phương pháp/mánh khoé/thủ đoạn
无情	 無情	 vô tình	 vô tình/bạc tình/lạnh lẽo/tuyệt tình/không thương tiếc gì/không nể tình/nhẫn tâm/tàn nhẫn
治安	 治安	 trị an	 trị an/an ninh trật tự
流通	 流通	 lưu thông	 lưu thông/thoáng/không bí
不堪	 不堪	 bất kham	 không chịu nổi/bất kham/chịu không thấu/không thể/cực kỳ/thậm/kinh khủng/không thể tả/quá chừng/quá quắt/bất trị/chịu hết thấu/chịu không nổi/chẳng chịu được
自称	 自稱	 tự xưng	 tự xưng/xưng/tự cho là/tự tung tin/tự đánh giá/tự nói
条例	 條例	 điều lệ	 điều lệ
惩罚	 懲罰	 trừng phạt	 trừng phạt/nghiêm phạt/nghiêm trị/nghiêm khắc trừng trị/nghiêm khắc trừng phạt
分布	 分布	 phân bố	 phân bố/rải rác/phân phối
失踪	 失蹤	 thất tung	 mất tích/thất tung
极端	 極端	 cực đoan	 cực đoan/tột cùng/vô cùng/cực kỳ
犯人	 犯人	 phạm nhân	 phạm nhân/tội phạm
光荣	 光榮	 quang vinh	 quang vinh/vinh quang/vẻ vang/vinh dự
体力	 體力	 thể lực	 thể lực/sức khoẻ
风情	 風情	 phong tình	 phong tình/lẳng lơ/tình cảm/tâm tình/cử chỉ/tình hình gió/cử chỉ bên ngoài/phong thổ nhân tình
专用	 專用	 chuyên dụng	 chuyên dụng/riêng/chuyên dùng vào/chuyên môn
贵族	 貴族	 quý tộc	 quý tộc
依赖	 依賴	 ỷ lại	 ỷ lại/nương tựa/dựa vào
口味	 口味	 khẩu vị	 khẩu vị/hương vị/mùi vị/gu
新娘	 新孃	 tân nương	 tân nương/cô dâu/tân giai nhân
公子	 公子	 công tử	 công tử
失业	 失業	 thất nghiệp	 thất nghiệp/không có việc làm
湖北	 湖北	 hồ bắc	 Hồ Bắc
地狱	 地獄	 địa ngục	 địa ngục/âm phủ/địa phủ
清理	 清理	 thanh lí/thanh lý	 rửa sạch/thanh lý/kiểm kê/dọn dẹp
地震	 地震	 địa chấn	 động đất/địa chấn/chấn động
家园	 家園	 gia viên	 gia viên/quê hương/gia đình/vườn nhà/cây nhà lá vườn/nhà làm
景色	 景色	 cảnh sắc	 cảnh sắc/phong cảnh/cảnh vật/cảnh
原文	 原文	 nguyên văn	 nguyên văn
符号	 符號	 phù hiệu	 ký hiệu/dấu hiệu/dấu/phù hiệu
艰苦	 艱苦	 gian khổ	 gian khổ/khó khăn gian khổ/gian nan khổ cực
神圣	 神聖	 thần thánh	 thần thánh/thiêng liêng
亲密	 親密	 thân mật	 thân mật/thân thiết
讲解	 講解	 giảng giải	 giảng giải/giải thích/giới thiệu
业余	 業餘	 nghiệp dư	 nghiệp dư/không chuyên
委托	 委託	 ủy thác	 ủy thác/uỷ thác/nhờ
人力	 人力	 nhân lực	 nhân lực/sức người
时机	 時機	 thời cơ	 thời cơ
阶级	 階級	 giai cấp	 giai cấp/bậc thềm/cấp bậc/đẳng cấp
反抗	 反抗	 phản kháng	 phản kháng/đấu tranh/chống/chống lại
占领	 占領	 chiếm lĩnh	 chiếm lĩnh/chiếm đóng/chiếm cứ/chiếm/chiếm giữ
尊严	 尊嚴	 tôn nghiêm	 tôn nghiêm/danh dự/trang trọng/uy nghiêm
繁华	 繁華	 phồn hoa	 phồn hoa/sầm uất/phồn thịnh
会谈	 會談	 hội đàm	 hội đàm/hoà đàm/đàm phán
西北	 西北	 tây bắc	 tây bắc/Tây Bắc
提议	 提議	 đề nghị	 đề nghị/vấn đề nêu ra bàn bạc
随身	 隨身	 tùy thân	 tùy thân/mang bên mình/theo bên người
名义	 名義	 danh nghĩa	 danh nghĩa/tư cách/về danh nghĩa/trên danh nghĩa
外界	 外界	 ngoại giới	 ngoại giới/bên ngoài
克服	 克服	 khắc phục	 vượt qua/khắc phục/chinh phục/chế ngự/giải quyết/khắc chế/chịu đựng/chịu
性能	 性能	 tính năng	 tính năng
京城	 京城	 kinh thành	 kinh thành/kinh đô
村庄	 村莊	 thôn trang	 thôn trang/làng mạc/thôn xóm
能量	 能量	 năng lượng	 năng lượng
大队	 大隊	 đại đội	 đại đội/đại đại
预算	 預算	 dự toán	 dự toán/dự trù/dự thảo
高峰	 高峰	 cao phong	 cao phong/đỉnh cao/đỉnh núi cao/cao điểm
菩萨	 菩薩	 bồ tát	 Bồ Tát/Phật/thần Phật/tấm lòng Bồ tát
卫星	" 衛星	 vệ tinh	 vệ tinh/vệ tinh nhân tạo/thiên thể quay quanh hành tinh, bản thân nó không thể phát sáng, như mặt trăng là vệ tinh của trái đất	 #3659	 f: 15.02"	ｗｅｉ４卫ｘｉｎｇ１星	
助理	 助理	 trợ lí/trợ lý	 trợ lý/giúp việc
自在	 自在	 tự tại	 tự tại/tự do/không bị ràng buộc/an nhàn/dễ chịu/thanh thản
视觉	 視覺	 thị giác	 thị giác
证券	 證券	 chứng khoán	 chứng khoán
入口	 入口	 nhập khẩu	 nhập khẩu/vào cửa/vào miệng/nhập cảng/cửa vào/cổng vào
舆论	 輿論	 dư luận	 dư luận
用心	 用心	 dụng tâm	 dụng tâm/chăm chỉ/để tâm/ý định/mưu đồ
检验	 檢驗	 kiểm nghiệm	 kiểm nghiệm/kiểm tra
书法	 書法	 thư pháp	 thư pháp/bút pháp
定期	 定期	 định kỳ	 định kỳ/thường lệ/định ngày/định thời gian/theo kỳ hạn
工艺	 工藝	 công nghệ	 công nghệ/kỹ thuật/thủ công mỹ nghệ
理智	 理智	 lí trí/lý trí	 lý trí
题材	 題材	 đề tài	 đề tài
魔法	 魔法	 ma pháp	 ma pháp
流传	 流傳	 lưu truyền	 truyền lưu/lưu truyền/truyền đi
生死	 生死	 sinh tử	 sinh tử/sống chết
举动	 舉動	 cử động	 hành động/cử động/động tác/việc làm
生理	 生理	 sinh lý	 sinh lý/sinh lí
服饰	 服飾	 phục sức	 phục sức/quần áo và trang sức
损害	 損害	 tổn hại	 tổn hại
国语	 國語	 quốc ngữ	 quốc ngữ/ngữ văn/bài học ngữ văn
通用	 通用	 thông dụng	 thông dụng/dùng phổ biến/dùng thay/dùng thay cho nhau
志愿	 志願	 chí nguyện	 chí nguyện/chí hướng và nguyện vọng/tự nguyện/tình nguyện
电台	 電臺	 điện đài	 radio/điện đài/điện đài vô tuyến/đài phát thanh
不明	 不明	 bất minh	 không rõ/bất minh/không biết/không chắc chắn/còn ngờ vực/không phân biệt được/không hiểu/tối tăm/khó hiểu/mù mịt/không rõ ràng
精灵	 精靈	 tinh linh	 tinh linh/quỷ quái/ma quỷ/yêu tinh/ranh mãnh/tinh ranh/khôn lanh/bóng ma/thần/ma
热心	 熱心	 nhiệt tâm	 nhiệt tâm/nhiệt tình/sốt sắng
占据	 占據	 chiếm cứ	 chiếm cứ/chiếm/chiếm giữ
民国	 民國	 dân quốc	 dân quốc
自学	 自學	 tự học	 tự học
永恒	 永恆	 vĩnh hằng	 vĩnh hằng/vĩnh viễn/mãi mãi/đời đời bền vững
会长	 會長	 hội trưởng	 hội trưởng
武装	 武裝	 võ trang/vũ trang	 võ trang/vũ trang/trang bị
操场	 操場	 thao trường	 sân thể dục/thao trường/bãi tập
是非	 是非	 thị phi	 thị phi/không phải là/là phi/đúng sai/phải trái/chuyện lôi thôi/điều rắc rối
冒险	 冒險	 mạo hiểm	 mạo hiểm/phiêu lưu/liều lĩnh/vuốt râu cọp/nhắm mắt đưa chân
演奏	 演奏	 diễn tấu	 diễn tấu
模型	 模型	 mô hình	 mô hình/khuôn/hình mẫu/khuôn đổ/khuôn ép/khuôn mẫu
建造	 建造	 kiến tạo	 kiến tạo/xây dựng/làm ra/lập nên/làm nên/dựng nên
援助	 援助	 viện trợ	 viện trợ/giúp đỡ/cứu trợ/chi viện
继承	 繼承	 kế thừa	 kế thừa/thừa kế/thừa tự/thừa hưởng/kế tục
内衣	 內衣	 nội y	 nội y/áo trong/áo lót
审查	 審查	 thẩm tra	 thẩm tra/xem xét/xét duyệt
江西	 江西	 giang tây	 Giang Tây/tỉnh Giang Tây
解答	 解答	 giải đáp	 giải đáp/giải/giải thích
普及	 普及	 phổ cập	 thông dụng/phổ cập/phổ biến/phổ biến rộng khắp
希腊	 希臘	 hi lạp/hy lạp	 Hy Lạp/Greece
遗产	 遺產	 di sản	 di sản/của để lại
赞成	 贊成	 tán thành	 tán thành/đồng ý/giúp hoàn thành/giúp cho thành
药品	 藥品	 dược phẩm	 dược phẩm/thuốc
妓女	 妓女	 kĩ nữ/kỹ nữ	 kỹ nữ/gái điếm
温和	 溫和	 ôn hòa	 ôn hòa/ấm áp/ôn hoà/mềm mỏng/dịu dàng/nhã nhặn/điềm đạm/êm dịu/ấm/nóng
排除	 排除	 bài trừ	 bài trừ/gạt bỏ/loại bỏ
狮子	 獅子	 sư tử	 sư tử
命名	 命名	 mệnh danh	 mệnh danh/đặt tên
绘画	 繪畫	 hội họa	 hội họa/hội hoạ/vẽ tranh/môn vẽ
糊涂	 糊塗	 hồ đồ	 hồ đồ/không rõ/mơ hồ/lơ mơ/lung tung/bừa bộn/hỗn loạn/vớ vẩn/không rõ ràng
天然	 天然	 thiên nhiên	 thiên nhiên/tự nhiên
邮政	 郵政	 bưu chính	 bưu chính/ngành bưu chính
女郎	 女郎	 nữ lang	 nữ lang/cô nàng
收回	 收回	 thu hồi	 thu hồi/thu về/lấy về/thủ tiêu/huỷ bỏ
不利	 不利	 bất lợi	 bất lợi/không có lợi/không thuận tiện/xui/rủi/có hại
文凭	 文憑	 văn bằng	 văn bằng/bằng tốt nghiệp/bằng cấp
病情	 病情	 bệnh tình	 bệnh tình/tình trạng bệnh
鉴定	 鑑定	 giám định	 xem xét/giám định/đánh giá/phân định/phân biệt định đoạt
种类	 種類	 chủng loại	 chủng loại/loại
侵犯	 侵犯	 xâm phạm	 xâm phạm/can thiệp
应对	 應對	 ứng đối	 ứng đối/đối đáp/trả lời/đáp lời
家门	 家門	 gia môn	 gia môn/cửa chính/gia tộc tôi/gia đình tôi/nhà tôi
终身	 終身	 chung thân	 chung thân/cả đời/suốt đời/trọn đời
自行	 自行	 tự hành	 tự hành/tự mình làm/tự động
凶手	 凶手	 hung thủ	 hung thủ/kẻ giết người
水晶	 水晶	 thủy tinh	 thủy tinh/thạch anh
过度	 過度	 quá độ	 quá độ/quá/quá mức/quá đáng/vượt quá giới hạn
指点	 指點	 chỉ điểm	 chỉ điểm/chỉ vẽ/chỉ bảo/xoi mói/nói xấu
文本	 文本	 văn bản	 văn bản
加速	 加速	 gia tốc	 gia tốc/tăng tốc/tăng tốc độ/tăng nhanh
平民	 平民	 bình dân	 bình dân/người bình thường/dân thường
同伴	 同伴	 đồng bạn	 đồng bạn/bạn/đồng nghiệp/người cùng ăn với mình
优先	 優先	 ưu tiên	 ưu tiên
礼拜	 禮拜	 lễ bái	 tuần/lễ bái/cúng lễ/tuần lễ/thứ/ngày thứ/chủ nhật/ngày chủ nhật
会见	 會見	 hội kiến	 hội kiến/gặp mặt/gặp gỡ/tiếp kiến
智能	 智能	 trí năng	 trí năng/trí tuệ và năng lực/có trí tuệ và năng lực của con người
接收	 接收	 tiếp thu	 tiếp thu/nhận/thu/bắt/tiếp nhận/thu nạp/kết nạp
福利	 福利	 phúc lợi	 phúc lợi/mang lại lợi ích
书房	 書房	 thư phòng	 thư phòng/phòng sách
师兄	 師兄	 sư huynh	 sư huynh
解除	 解除	 giải trừ	 giải trừ/bỏ/xua tan/huỷ bỏ/làm ... dịu đi
假设	 假設	 giả thiết	 giả thiết/giả như/tỉ như/giả dụ/giả thuyết
印刷	 印刷	 ấn loát	 in ấn/ấn loát
小人	 小人	 tiểu nhân	 tiểu nhân/kẻ ty tiện bỉ ổi
教会	 教會	 giáo hội	 giáo hội
火箭	 火箭	 hỏa tiễn	 hỏa tiễn/tên lửa/hoả tiễn
宽容	 寬容	 khoan dung	 khoan dung
公元	 公元	 công nguyên	 công nguyên/công lịch
无知	 無知	 vô tri	 không biết/vô tri/mít đặc/tịt mít/không biết gì/không có tri thức/dốt đặc cán mai
总共	 總共	 tổng cộng	 tổng cộng/tất cả/cả thảy
执法	 執法	 chấp pháp	 chấp pháp/chấp hành pháp luật
法制	 法制	 pháp chế	 pháp chế/phép chế
圣经	 聖經	 thánh kinh	 thánh kinh/Thánh Kinh/kinh thánh
战胜	 戰勝	 chiến thắng	 chiến thắng/thắng lợi
分裂	 分裂	 phân liệt	 phân liệt/phân tách/phân/chia rẽ/tách rời/tách ra
不便	 不便	 bất tiện	 không tiện/bất tiện/không thuận tiện/không tiện lợi/không vừa/phiền phức/thiếu tiền xài/thiếu tiền tiêu/kẹt tiền
孔子	 孔子	 khổng tử	 Khổng Tử
平日	 平日	 bình nhật	 ngày thường/thường ngày/thường thường/bình nhật
总数	 總數	 tổng số	 tổng số
繁荣	 繁榮	 phồn vinh	 phồn vinh/phát triển mạnh/phồn thịnh/làm cho phồn vinh/làm phồn thịnh/làm cho phát triển
极度	 極度	 cực độ	 cực độ/vô cùng/hết sức/quá sức/hết mức/cực điểm
学问	 學問	 học vấn	 học vấn/tri thức/học thức
点心	 點心	 điểm tâm	 điểm tâm/lót dạ/lót lòng/bánh ngọt
大使	 大使	 đại sứ	 đại sứ
条款	 條款	 điều khoản	 điều khoản/điều
古人	 古人	 cổ nhân	 cổ nhân/người xưa
处罚	 處罰	 xử phạt	 xử phạt/ngả vạ/trừng phạt/trừng trị
外来	 外來	 ngoại lai	 ngoại lai/từ bên ngoài đến
全力	 全力	 toàn lực	 toàn lực/hết sức
凤凰	 鳳凰	 phượng hoàng	 phượng hoàng
歧视	 歧視	 kỳ thị	 kỳ thị/phân biệt đối xử/phân biệt
案子	 案子	 án tử	 án tử/bàn con/mâm/bàn dài/bàn/vụ án/án kiện/ca/trường hợp
保密	 保密	 bảo mật	 giữ bí mật/bảo mật
谨慎	 謹慎	 cẩn thận	 cẩn thận/thận trọng/dè dặt
原料	 原料	 nguyên liệu	 nguyên liệu
调节	 調節	 điều tiết	 điều tiết/điều hoà/điều chỉnh
香味	 香味	 hương vị	 mùi/hương vị
议员	 議員	 nghị viên	 nghị viên/nghị sĩ
往来	 往來	 vãng lai	 lui tới/vãng lai/đi lại/qua lại/tới lui/thăm viếng/lai vãng
手下	 手下	 thủ hạ	 dưới tay/thủ hạ/dưới quyền/thuộc hạ/trong tay/trong tầm tay/bên mình/tình hình kinh tế
处女	 處女	 xử nữ	 xử nữ/thiếu nữ/trinh nữ/gái trinh/lần đầu/đầu tiên/đầu tay/chưa kinh nghiệm/chưa được khai thác
美金	 美金	 mỹ kim	 Mĩ kim/mỹ kim/đồng đô-la Mỹ/Mỹ kim
混合	 混合	 hỗn hợp	 hỗn hợp/trộn/nhào/phối hợp/hoà vào nhau/pha trộn
不定	 不定	 bất định	 không chừng/bất định/chưa chắc/không biết/không chắc
华夏	 華夏	 hoa hạ	 Hoa Hạ/Trung Hoa/Trung Quốc
提倡	 提倡	 đề xướng	 đề xướng/khởi xướng
开通	" 開通	 khai thông	 khai thông/đả thông/làm thoáng/bắt đầu sử dụng/đưa vào sử dụng/[kāi ·tong]/thông thoáng/tư tưởng tiến bộ, thông suốt/đả thông tư tưởng/mở mang trí óc/mở mang/sáng suốt	 #4127	 f: 13.03"	ｋａｉ１开ｔｏｎｇ１通	
神色	 神色	 thần sắc	 thần sắc/vẻ/vẻ mặt
重量	 重量	 trọng lượng	 sức nặng/trọng lượng
专制	 專制	 chuyên chế	 chuyên chế/độc tài chuyên chế
恶劣	 惡劣	 ác liệt	 ác liệt/tồi tệ/xấu xa/tồi/tầm thường
作风	 作風	 tác phong	 tác phong/phong cách
职责	 職責	 chức trách	 chức trách/trách nhiệm
融合	 融合	 dung hợp	 dung hợp/hoà hợp
征服	 征服	 chinh phục	 chinh phục/đánh chiếm
联盟	 聯盟	 liên minh	 liên minh
乐园	 樂園	 lạc viên	 chỗ vui chơi/thiên đường/nơi vui chơi/lạc viên
贫穷	 貧窮	 bần cùng	 bần cùng/nghèo khó/nghèo túng/nghèo khổ/cùng khổ
伤感	 傷感	 thương cảm	 thương cảm/đa cảm
尽力	 盡力	 tận lực	 hết sức/tận lực/nỗ lực/gắng sức/cố gắng/ráng
本能	 本能	 bản năng	 bản năng
危害	 危害	 nguy hại	 nguy hại/tổn hại/làm hại
西南	 西南	 tây nam	 tây nam/Tây Nam
保守	 保守	 bảo thủ	 bảo thủ/thủ cựu/dè dặt/thận trọng/giữ/giữ lại/giữ đúng/tuân theo/giữ gìn/giấu/che chở/tuân thủ/ôm giữ
判决	 判決	 phán quyết	 phán quyết/kết án/tuyên án
捐赠	 捐贈	 quyên tặng	 quyên tặng/quyên/tặng/biếu
制服	 制服	 chế phục	 chế phục/chế ngự/bắt phục tùng/đồng phục/đồ đồng phục
历程	 歷程	 lịch trình	 lịch trình/quá trình/con đường trải qua
发誓	 發誓	 phát thệ	 thề/phát thệ/xin thề/lập thệ
大纲	 大綱	 đại cương	 đại cương/dàn ý/đề cương
招牌	 招牌	 chiêu bài	 chiêu bài/bảng hiệu/tấm biển
立法	 立法	 lập pháp	 lập pháp
杰出	 傑出	 kiệt xuất	 kiệt xuất/xuất chúng/xuất sắc/lỗi lạc/phi thường/tuyệt vời
华丽	 華麗	 hoa lệ	 hoa lệ/lộng lẫy/đẹp đẽ và rực rỡ/tráng lệ
魔鬼	 魔鬼	 ma quỷ	 ma quỷ/ma
罪恶	 罪惡	 tội ác	 tội ác
概括	 概括	 khái quát	 khái quát/tổng quát/nhìn chung/tóm tắt/tóm lược
艺人	 藝人	 nghệ nhân	 nghệ nhân/nghệ sĩ
起点	 起點	 khởi điểm	 khởi điểm/khởi đầu/điểm xuất phát
动静	 動靜	 động tĩnh	 động tĩnh/tiếng động/tình hình/tin tức
音响	 音響	 âm hưởng	 âm hưởng/thính giác/âm thanh/giọng
纪律	 紀律	 kỉ luật/kỷ luật	 kỷ luật
监视	 監視	 giám thị	 giám thị/theo dõi/coi xét
封闭	 封閉	 phong bế	 phong bế/đóng chặt lại/đóng kín lại/khép kín/gắn xi/phủ kín/niêm phong
说服	 說服	 thuyết phục	 thuyết phục
起诉	 起訴	 khởi tố	 khởi tố/truy tố/đưa ra toà/kiện
纯洁	 純潔	 thuần khiết	 thuần khiết/trong sạch/trong sáng/thanh khiết/trong trắng/trinh bạch/đức hạnh/gạn/lọc/lọc trong/tinh chế/làm trong sạch/rửa sạch/gột sạch/tẩy uế
红旗	 紅旗	 hồng kỳ	 hồng kỳ/cờ đỏ/tiên tiến
商家	 商家	 thương gia	 thương gia/nhà buôn
君子	 君子	 quân tử	 quân tử
集合	 集合	 tập hợp	 tập hợp/tụ tập/thu thập
动机	 動機	 động cơ	 động cơ
正规	 正規	 chính quy	 chính quy/nề nếp
杀手	 殺手	 sát thủ	 sát thủ
联邦	 聯邦	 liên bang	 liên bang
部落	 部落	 bộ lạc	 bộ lạc/bộ tộc/thị tộc
大战	 大戰	 đại chiến	 đại chiến/giải thi đấu/cuộc chiến lớn/cuộc chiến ác liệt/cuộc chiến quy mô lớn
被动	 被動	 bị động	 bị động/thụ động
教程	 教程	 giáo trình	 giáo trình
细胞	 細胞	 tế bào	 tế bào
对抗	 對抗	 đối kháng	 đối kháng/đối đầu/chống lại/chống cự/chống đối
循环	 循環	 tuần hoàn	 tuần hoàn
效应	 效應	 hiệu ứng	 hiệu ứng
失落	 失落	 thất lạc	 mất mác/thất lạc/mất mát/lạc
地主	 地主	 địa chủ	 địa chủ/người bản địa/người bản xứ
人事	 人事	 nhân sự	 nhân sự/việc đời/phải trái/việc người/việc làm nằm trong khả năng người/cảm giác/tri giác/lễ vật
出手	 出手	 xuất thủ	 ra tay/xuất thủ/tung hàng/bán hàng ra/lấy ra/cầm ra/chiều dài tay áo/bản lĩnh/ném chuyền/đánh nhau
黑白	 黑白	 hắc bạch	 hắc bạch/đen trắng/trắng đen/phải trái/thiện ác
文人	 文人	 văn nhân	 văn nhân/trí thức/người có học
权限	 權限	 quyền hạn	 quyền hạn
入境	 入境	 nhập cảnh	 nhập cảnh
智力	 智力	 trí lực	 trí lực/trí khôn/năng lực
国庆	 國慶	 quốc khánh	 quốc khánh
大爷	 大爺	 đại gia	 đại gia/ông lớn/cụ lớn/bác
隆重	 隆重	 long trọng	 long trọng/linh đình/trọng thể
元素	 元素	 nguyên tố	 nguyên tố/yếu tố/nguyên tố hoá học
近代	 近代	 cận đại	 cận đại/thời đại tư bản chủ nghĩa
强制	 強制	 cưỡng chế	 cưỡng chế/ép buộc
海关	 海關	 hải quan	 hải quan
见识	 見識	 kiến thức	 kiến thức/hiểu biết/mở mang kiến thức/tri thức
爱尔兰	 愛爾蘭	 ái nhĩ lan	 Ai-len/Ái Nhĩ Lan/Ireland
工夫	 工夫	 công phu	 công phu/người làm thuê/người làm mướn/thời gian/thì giờ/công sức/ngày rảnh rỗi/rỗi rãi/rảnh lúc/khi
侵略	 侵略	 xâm lược	 xâm lược/xâm lăng
特性	 特性	 đặc tính	 đặc tính
人工	 人工	 nhân công	 nhân công/nhân tạo/nhân lực/sức người
表扬	 表揚	 biểu dương	 khen ngợi/biểu dương/khen/tuyên dương/tán dương/ca ngợi/tôn vinh/ca tụng
高尚	 高尚	 cao thượng	 cao thượng/cao cả/cao quý/thanh cao/cao nhã/có ý nghĩa/không tầm thường
土耳其	 土耳其	 thổ nhĩ kỳ	 Thổ Nhĩ Kỳ/Turkey
信用	" 信用	 tín dụng	 tín dụng/uy tín/chữ tín/tin dùng, có tín nhiệm/tin dùng	 #4503	 f: 11.67"	ｘｉｎ４信ｙｏｎｇ４用	
口音	 口音	 khẩu âm	 khẩu âm/giọng/giọng nói/thổ âm/giọng địa phương
初级	 初級	 sơ cấp	 sơ cấp/sơ bộ/sơ đẳng/bước đầu/thô sơ/sơ khai
蒙古	 蒙古	 mông cổ	 Mông Cổ
改编	 改編	 cải biên	 cải biên/soạn lại/biên chế lại
心理学	 心理學	 tâm lý học	 tâm lý học
一贯	 一貫	 nhất quán	 nhất quán/trước sau như một
总部	 總部	 tổng bộ	 tổng bộ/cơ quan đầu não/bộ tổng tư lệnh/quân uỷ trung ương/văn phòng chính/trụ sở chính
打倒	 打倒	 đả đảo	 đả đảo/đánh ngã/ngã/té/lật đổ/đánh đổ
内在	 內在	 nội tại	 nội tại/bên trong
好心	 好心	 hảo tâm	 hảo tâm/tấm lòng vàng/lòng tốt/lòng chân thật
西瓜	 西瓜	 tây qua	 tây qua/dưa hấu/dưa đỏ/quả dưa hấu/trái dưa hấu
残忍	 殘忍	 tàn nhẫn	 tàn nhẫn/hung ác độc địa
抵抗	 抵抗	 để kháng	 chống cự/chống lại/đề kháng/để kháng/chống cự lại
潜力	 潛力	 tiềm lực	 tiềm lực/sức tiềm tàng/khả năng tiềm tàng
抑制	 抑制	 ức chế	 ức chế/đè nén/khống chế/đè xuống/dằn xuống/nén
春秋	 春秋	 xuân thu	 xuân thu/tuổi tác/mùa xuân và mùa thu/năm/kinh Xuân Thu/thời Xuân Thu
情愿	 情願	 tình nguyện	 tình nguyện/bằng lòng/cam chịu/thà rằng/thà
绝食	 絕食	 tuyệt thực	 tuyệt thực/nhịn ăn
匿名	 匿名	 nặc danh	 nặc danh/giấu tên
传达	 傳達	 truyền đạt	 nhắn dùm/nhắn nhủ/truyền đạt/thông tri/chuyển/truyền/tuyên bố/công bố/bày tỏ/theo dõi/hướng dẫn/đón tiếp/người thường trực/người gác cổng/người dẫn chỗ/người chỉ chỗ ngồi
高贵	 高貴	 cao quý	 cao quý/cao cả/cao sang/quý phái/sang trọng
形态	 形態	 hình thái	 hình thái/hình dạng/hình dáng
因果	 因果	 nhân quả	 nhân quả/nguyên nhân và kết quả
众生	 眾生	 chúng sinh	 chúng sinh
护理	 護理	 hộ lí/hộ lý	 hộ lý/người hộ lý/bảo vệ quản lý
预备	 預備	 dự bị	 dự bị/chuẩn bị/sửa soạn/sẵn sàng
英俊	 英俊	 anh tuấn	 anh tuấn/tài năng xuất chúng/khôi ngô tuấn tú/khôi ngô
字典	 字典	 tự điển	 tự điển
基督	 基督	 cơ đốc	 chúa cứu thế/chúa Giê-su/Cơ Đốc
出入	 出入	 xuất nhập	 xuất nhập/ra vào/không khớp/chênh lệch/không nhất quán
大王	 大王	 đại vương	 Đại vương/đại vương/vua/chúa/thủ lĩnh
期限	 期限	 kỳ hạn	 kỳ hạn/thời hạn
圆满	 圓滿	 viên mãn	 viên mãn/toàn vẹn/hoàn hảo/tốt đẹp/chu đáo
消化	 消化	 tiêu hóa	 tiêu hóa/tiêu hoá/tiêu tan vật chất hóa ra chất khác
野蛮	 野蠻	 dã man	 dã man/không văn minh/không có văn hoá/ngang tàng bạo ngược
轨道	 軌道	 quỹ đạo	 quỹ đạo/đường ray/đường xe điện/nề nếp/khuôn khổ
特务	 特務	 đặc vụ	 đặc vụ/nhiệm vụ đặc biệt/đặc nhiệm
不觉	 不覺	 bất giác	 bất giác/chưa phát giác ra/chưa phát giác/chưa phát hiện/không ngờ
古怪	 古怪	 cổ quái	 cổ quái/kỳ dị/kỳ lạ/quái đản/gàn dở/lập dị
打动	 打動	 đả động	 đả động/cảm động/làm cảm động/xúc động/rung động
路程	 路程	 lộ trình	 lộ trình/đường đi/chặng đường/hành trình
诚实	 誠實	 thành thật	 thành thực/thành thật/không giả dối/trung thực/chính xác/đúng đắn
贯彻	 貫徹	 quán triệt	 quán triệt/thi hành/thực hiện/thông suốt
父子	 父子	 phụ tử	 phụ tử/cha con
对照	 對照	 đối chiếu	 đối chiếu/so sánh
容量	 容量	 dung lượng	 dung lượng/lượng chứa/số lượng dung nạp
淘汰	 淘汰	 đào thải	 đào thải/đấu loại/loại bỏ/sàng lọc
皇上	 皇上	 hoàng thượng	 Hoàng Thượng/hoàng thượng/Hoàng thượng/hoàng đế
院士	 院士	 viện sĩ	 viện sĩ/viện sĩ hàn lâm
愚蠢	 愚蠢	 ngu xuẩn	 ngu xuẩn/ngu dại
预定	 預定	 dự định	 dự định/định/dự tính
自愿	 自願	 tự nguyện	 tự nguyện
